### ISSUE TITLE
running sample application on raspberrypi zero w getting premature close error

### ISSUE THREAD

**Issue by sasasavic82** [aws/aws-iot-device-sdk-js#222]
working fine on my mac, transferred the sample app onto raspberry pi zero w, getting the below

any ideas? I have all the certs, and everything required to connect.

```
pi@pids01iot150:~/iot $ ./start.sh

Running pub/sub sample application...
offline
error Error: premature close
    at TLSSocket.onclose (/home/pi/iot/node_modules/end-of-stream/index.js:47:67)
    at TLSSocket.emit (events.js:185:15)
    at _handle.close (net.js:541:12)
    at TCP.done [as _onclose] (_tls_wrap.js:379:7)
close
reconnect
error Error: premature close
    at TLSSocket.onclose (/home/pi/iot/node_modules/end-of-stream/index.js:47:67)
    at TLSSocket.emit (events.js:185:15)
    at _handle.close (net.js:541:12)
    at TCP.done [as _onclose] (_tls_wrap.js:379:7)
close
```

**Comment by sasasavic82** [comment]
I did some more digging. F```
rom my mac, i see this:

➜ telnet a1o1xryvmqvun7.iot.us-east-1.amazonaws.com 8883
Trying 52.0.89.237...
Connected to dualstack.iotmoonraker-u-elb-1bkszq0bvnbyv-1001897703.us-east-1.elb.amazonaws.com.
Escape character is '^]'.
```

However, on my Pi, when trying to telnet to the endpoint, nothing happens
```
pi@pids01iot150:~/iot/node_modules/end-of-stream $ telnet a1o1xryvmqvun7.iot.us-east-1.amazonaws.com 8883
s
a
^C
```

But when I try the resolved end-point, then I can connect:

```
pi@pids01iot150:~/iot/node_modules/end-of-stream $ telnet dualstack.iotmoonraker-u-elb-1bkszq0bvnbyv-1001897703.us-east-1.elb.amazonaws.com 8883
Trying 34.203.1.15...
Connected to dualstack.iotmoonraker-u-elb-1bkszq0bvnbyv-1001897703.us-east-1.elb.amazonaws.com.
Escape character is '^]'.
^]
```
I have a feeling that this may not be an issue with the lib, but something to do with networking and the resolution of the host? ... 

Perhaps somebody may be able to shine some light.

**Comment by sasasavic82** [comment]
Furthermore, when I do tcpdump:

```
pi@pids01iot150:~ $ sudo tcpdump -i wlan0 'port 8883'
tcpdump: verbose output suppressed, use -v or -vv for full protocol decode
listening on wlan0, link-type EN10MB (Ethernet), capture size 262144 bytes
^C
0 packets captured
0 packets received by filter
0 packets dropped by kernel
pi@pids01iot150:~ $ sudo tcpdump -i wlan0 'port 8883'
tcpdump: verbose output suppressed, use -v or -vv for full protocol decode
listening on wlan0, link-type EN10MB (Ethernet), capture size 262144 bytes
10:41:31.222327 IP 192-168-1-5.tpgi.com.au.35094 > ec2-54-210-6-46.compute-1.amazonaws.com.8883: Flags [S], seq 1444084204, win 29200, options [mss 1460,sackOK,TS val 1824662056 ecr 0,nop,wscale 6], length 0
10:41:31.470141 IP ec2-54-210-6-46.compute-1.amazonaws.com.8883 > 192-168-1-5.tpgi.com.au.35094: Flags [S.], seq 3410090077, ack 1444084205, win 26847, options [mss 1412,sackOK,TS val 342493706 ecr 1824662056,nop,wscale 8], length 0
10:41:31.470362 IP 192-168-1-5.tpgi.com.au.35094 > ec2-54-210-6-46.compute-1.amazonaws.com.8883: Flags [.], ack 1, win 457, options [nop,nop,TS val 1824662304 ecr 342493706], length 0
```

First one returns zero packets captured when attempting to telnet to **a1o1xryvmqvun7.iot.us-east-1.amazonaws.com**

but captures when i attempt on: **dualstack.iotmoonraker-u-elb-1bkszq0bvnbyv-1001897703.us-east-1.elb.amazonaws.com**

really bizzare ...

**Comment by sasasavic82** [comment]
Ok .. for anybody experiencing this issue, it was the DNS resolution.

just make sure to add the IP address of the AWS IoT endpoint for your specific region in **/etc/hosts** file 

XXX.XXX.XXX.XXX   XXXXXXXXX.iot.us-east-1.amazonaws.com

**Comment by matiasdecarli** [comment]
Be careful with this approach. DNS do change overnight and you could end up with a major issue

**Comment by imayur7** [comment]
I do the same thing but still getting an error to me:

my issue is here #272

**Comment by sdessingou** [comment]
When I run my program I am getting below issue: 
`
events.js:200
throw er; // Unhandled 'error' event
^
Error: premature close
at onclosenexttick (xxx/node_modules/end-of-stream/index.js:54:86)
at processTicksAndRejections (internal/process/task_queues.js:76:11)

Emitted 'error' event on DeviceClient instance at:
at MqttClient. (xxx/node_modules/aws-iot-device-sdk/device/index.js:772:15)
at MqttClient.emit (events.js:228:7)
at TLSSocket.f (xxx/node_modules/once/once.js:25:25)
at onclosenexttick (xxx/node_modules/end-of-stream/index.js:54:73)
at processTicksAndRejections (internal/process/task_queues.js:76:11)`

**Comment by mkolbusz** [comment]
@sdessingou Have you managed a problem? I have the same one with the basic JavaScript code in Node.js.

**Comment by jankes44** [comment]
Same problem here, but other line in events.js
events.js:174
 throw er; // Unhandled 'error' event
      ^

Error: premature close
    at onclosenexttick (xxx/server/node_modules/end-of-stream/index.js:54:86)
